{
  "as_of": "2026-05-15T15:00:00+03:00",
  "timeframe": "1H",
  "universe": ["SBER", "LKOH", "GAZP"],
  "feature_spec": {
    "quant_features": ["ret_1h", "ret_3h", "vol_z", "rel_strength_20"],
    "news_features": ["sentiment", "impact_score", "novelty"],
    "cross_sectional_normalized": true
  },
  "entries": [
    { "ticker": "SBER", "quant": [0.41, 0.83, -0.12, 1.05], "news": [0.34, 0.62, 0.71], "valid": true },
    { "ticker": "LKOH", "quant": [-0.05, 0.10, 0.22, 0.08], "news": [0.00, 0.00, 0.00], "valid": true },
    { "ticker": "GAZP", "quant": [-0.88, -0.71, 1.40, -1.13], "news": [-0.45, 0.55, 0.60], "valid": true }
  ],
  "is_production": false
}
